Title,path
philippines contact cement market size,/research-report/philippines-contact-cement-market/
skin and soft tissue infection market size,/research-report/global-skin-and-soft-tissue-infections-market/
africa autoclaved aerated concrete market size,/research-report/africa-autoclaved-aerated-concrete-market/
polypropylene battery separator market size,/research-report/polypropylene-battery-separator-market/
oncolytics virus therapy market size,/research-report/global-oncolytic-virus-therapy-market/
hazardous drug administration market size,/research-report/global-hazardous-drug-administration-market/
evaporative cooling market size,/research-report/global-evaporative-cooling-market/
systemic sclerosis market size,/research-report/systemic-sclerosis-market-size/
aerosol paints market size,/research-report/aerosol-paints-market/
asia pacific compound feed market size,/research-report/asia-compound-feed-market/
air core shunt reactor market size,/research-report/air-core-shunt-reactor-market/
macular edema market size,/research-report/macular-edema-market/
renal biomarkers market size,/research-report/renal-biomarkers-market/
commercial distributed power generation market size,/research-report/global-commercial-distributed-energy-generation-market/
vendor neutral archive and pacs market size,/research-report/vendor-neutral-archive-vna-and-pacs-market/
commerical distributed energy market size,/research-report/global-commercial-distributed-energy-generation-market/
low-calorie sweeteners market size,/research-report/global-low-calorie-sweeteners-market/
asia pacific adhesives and sealants market size,/research-report/asia-pacific-adhesives-sealants-market/
flax seed market size,/research-report/global-flax-seed-market/
"jam, jelly and preserves market size",/research-report/jam-jelly-and-preserves-market/
foam dressing market size,/research-report/global-foam-dressing-market/
oil and gas cloud application market size,/research-report/global-oil-gas-cloud-application-market/
diabetic neuropathic foot ulcers market size,/research-report/global-diabetic-neuropathic-foot-ulcers-market/
asia pacific aqua feed market size,/research-report/aqua-feed-market/
water enhancers market size,/research-report/water-enhancers-market/
gas turbine distributed energy market size,/research-report/global-gas-turbine-distributed-energy-generation-market/
glaucoma therapeutic market size,/research-report/global-glaucoma-therapeutic-market/
plant bio-stimulants market size,/research-report/global-plant-biostimulants-market/
canada aesthetic devices market size,/research-report/aesthetic-devices-market/
agricultural fumigants market size,/research-report/global-agricultural-fumigants-market/
vegetable seed market size,/research-report/vegetable-seed-market/
agricultural testing market size,/research-report/global-agricultural-testing-market/
age related macular degeneration market size,/research-report/global-age-related-macular-degeneration-market/
feed mycotoxin detoxifiers market size,/research-report/global-feed-mycotoxin-detoxifiers/
enteral stenting procedure market size,/research-report/global-enteral-stenting-procedures-market/
industrial distributed energy generation market size,/research-report/global-commercial-distributed-energy-generation-market/
automotive testing market size,/research-report/global-automotive-testing-market/
fixed shunt reactor market size,/research-report/fixed-shunt-reactor-market/
glaucoma therapeutics market size,/research-report/global-glaucoma-therapeutic-market/
gut and digestive health ingredients market size,/research-report/global-gut-and-digestive-health-ingredients-market/
female sterilization market size,/research-report/global-female-sterilization-procedures-market/
needle free injections market size,/research-report/global-needle-free-injection-market/
fetal neonatal monitoring market size,/research-report/global-fetal-neonatal-monitoring-market/
lipid disorder market size,/research-report/global-lipid-disorder-market/
phytonutrients market size,/research-report/global-phytonutrients-market/
endometriosis drug market size,/research-report/endometriosi-drug-market/
lead acid battery separator market size,/research-report/polypropylene-battery-separator-market/
maiz,/corn seeds market size /research-report/maize-corn-seeds-market/
indonesia amino acid fertilizer market size,/product-category/agriculture/page/2/
variable shunt reactor market size,/research-report/variable-shunt-reactor-market/
battery separator market size,/research-report/lithium-ion-battery-separator-market/
cosmetic surgery equipments market size,/research-report/cosmetic-surgery-equipments-market/
non proliferative diabetic retinopathy market size,/research-report/global-non-proliferative-diabetic-retinopathy-market/
freeze-dried food market size,/research-report/global-freeze-dried-food-market/
high-performance alloys market size,/research-report/global-high-performance-alloys-market/
non-invasive blood pressure monitors market size,/research-report/global-non-invasive-blood-pressure-monitors-market/
diabetic macular edema size market size,/research-report/macular-edema-market/
diabetic macular edema market size,/research-report/macular-edema-market/
chia seeds market size,/research-report/global-chia-seeds-market/
oil immersed shunt reactor market size,/research-report/oil-immersed-shunt-reactor-market/
portable x-ray devices market size,/research-report/portable-x-ray-devices-market/
veterinary vaccines market size,/research-report/global-veterinary-vaccines-market/
forage seed market size,/research-report/global-forage-seed-market/
nuclear imaging market size,/research-report/nuclear-imaging-market/
wound care management devices market size,/research-report/wound-care-management-devices-market/
vehicle diagnostics market size,/research-report/global-vehicle-diagnostics-market/
brazil diagnostic imaging market size,/research-report/diagnostic-imaging-market/
diabetic foot ulcers market size,/research-report/global-diabetic-foot-ulcers-market-size/
cancer monoclonal antibodies market size,/research-report/cancer-monoclonal-antibodies-market/
agricultural chelates market size,/research-report/global-agricultural-chelates-market/
feed acidifiers market size,/research-report/feed-acidifiers-market/
feed yeast market size,/research-report/global-feed-yeast-market/
food sweeteners market size,/research-report/food-sweeteners-market/
food testing and certification market size,/research-report/food-testing-and-certification-market/
lithium ion battery separator market size,/research-report/lithium-ion-battery-separator-market/
pulp and paper chemicals market size,/research-report/global-pulp-and-paper-chemicals-market/
cbd water market size,/research-report/global-cbd-water-market/
pediatric clinical trails market size,/research-report/pediatric-clinical-trails-market/
seed treatment market size,/research-report/global-seed-treatment-market/
liquid feed market size,/research-report/liquid-feed-market/
building materials market size,/research-report/global-building-materials-market/
ancient grains market size,/research-report/ancient-grains-market/
contrast media injectors market size,/research-report/global-contrast-media-injectors-market/
glaucoma surgery devices market size,/research-report/glaucoma-surgery-devices-market/
hospital supplies market size,/research-report/hospital-supplies-market/
maleic anhydride market size,/research-report/global-maleic-anhydride-market/
vision care devices market size,/research-report/global-vision-care-devices-market/
central venous catheters market size,/research-report/global-central-venous-catheters-market/
diabetic nephropathy market size,/research-report/global-diabetic-nephropathy-market/
shunt reactor market size,/research-report/air-core-shunt-reactor-market/
sesame seeds market size,/research-report/sesame-seeds-market/
medical supplies and equipments market size,/research-report/medical-supplies-and-equipments-market/
airbag market size,/research-report/global-airbag-market/
automotive composite materials market size,/research-report/global-automotive-composite-materials-market/
metered dose inhaler devices market size,/research-report/global-metered-dose-inhaler-devices-market/
anti corrosion coatings market size,/research-report/anti-corrosion-coatings-market/
defoamers market size,/research-report/global-defoamers-market/
atopic dermatitis market size,/research-report/global-atopic-dermatitis-market/
peripherally inserted central catheter market size,/research-report/peripherally-inserted-central-catheter-market/
pressure ulcers market size,/research-report/global-pressure-ulcers-market/
patient monitoring accessories market size,/research-report/global-patient-monitoring-accessories-market/
medical imaging information systems market size,/research-report/global-medical-imaging-information-systems-market/
growth hormone deficiency market size,/research-report/global-growth-hormone-deficiency-market/
mobility aids and transportation equipments market size,/research-report/global-mobility-aids-and-transporation-equipments-market/
specialty chemicals market size,/research-report/global-specialty-chemicals-market/
uveitis market size,/research-report/global-uveitis-market/
barrier resins market size,/research-report/global-barrier-resins-market/
power line communication market size,/research-report/power-line-communication-market/
automotive filters market size,/research-report/global-automotive-filters-market/
functional beverages market size,/research-report/functional-beverages-market/
medicinal foods market size,/food-and-beverages-category/
automotive foams market size,/research-report/global-automotive-foams/
infusion systems market size,/research-report/global-infusion-systems-market/
industrial coatings market size,/research-report/industrial-coatings-market/
advanced materials market size,/research-report/global-advanced-materials-market/
cataract surgery devices market size,/research-report/cataract-surgery-devices-market/
seed coating materials market size,/research-report/seed-coating-materials-market/
meal kit market size,/research-report/global-meal-kit-market/
dyslipidemia market size,/research-report/global-dyslipidemia-market/
preventive vaccine market size,/research-report/global-preventive-vaccine-market/
syringes and needles market size,/research-report/global-syringes-and-needles-market/
neonatal monitors market size,/research-report/global-fetal-neonatal-monitoring-market/
contact adhesives market size,/research-report/contact-adhesives-market/
hydrocolloids market size,/research-report/global-hydrocolloids-market/
circuit breaker market size,/research-report/circuit-breaker-market/
fire safety equipment market size,/research-report/global-fire-safety-equipment-market/
disposable hospital supplies market size,/research-report/hospital-supplies-market/
laundry detergent market size,/research-report/laundry-detergent-market/
clinical trial market size,/research-report/clinical-trial-management-system-market/
plant proteins market size,/research-report/plant-proteins-market/
sterilization equipment market size,/research-report/sterilization-equipment-market/
sunflower seeds market size,/research-report/sunflower-seeds-market/
soy protein market size,/research-report/soy-protein-market/
lubricant additives market size,/research-report/lubricant-additives-market/
mammography market size,/research-report/global-mammography-market/
crohn's disease market size,/research-report/global-crohns-disease-market/
acute myeloid leukaemia therapeutics market size,/research-report/global-acute-myeloid-leukemia-market/
crop protection chemicals market size,/research-report/global-crop-protection-chemicals-market/
hemodialysis equipment market size,/research-report/hemodialysis-equipment-market/
systemic lupus erythematosus market size,/research-report/global-systemic-lupus-erythematosus-market/
central vascular access devices market size,/research-report/global-central-vascular-access-devices-market/
biopreservation market size,/research-report/biopreservation-market/
animal feed additives market size,/research-report/global-animal-feed-additives-market/
biopolymer market size,/research-report/global-bio-polymer-market/
agricultural micronutrients market size,/research-report/global-agricultural-micronutrients-market/
ophthalmic diagnostic equipments market size,/research-report/global-ophthalmic-diagnostic-equipment-market/
cardiac monitoring devices market size,/research-report/cardiac-monitoring-market/
medical aesthetic device market size,/research-report/medical-aesthetic-device-market/
nickel alloys market size,/research-report/global-nickel-alloys-market/
polymer emulsions market size,/research-report/polymer-emulsions-market/
weight management supplements market size,/research-report/weight-management-supplements-market/
acne vulgaris market size,/research-report/global-acne-vulgaris-acne-market/
in-vitro toxicology testing market size,/research-report/in-vitro-toxicology-testing-market/
active pharmaceutical ingredients market size,/research-report/active-pharmaceutical-ingredients-market/
bio surfactants market size,/research-report/global-bio-surfactants-market/
protective coatings market size,/research-report/global-protective-coatings-market/
fluorochemicals market size,/research-report/global-fluorochemicals-market/
ehealth market size,/research-report/ehealth-market/
fetal monitors market size,/research-report/global-fetal-monitors-market/
thermal spray market size,/research-report/thermal-spray-market/
aerospace coatings market size,/research-report/global-aerospace-coatings-market/
companion diagnostics market size,/research-report/companion-diagnostics-market/
frozen bakery products market size,/research-report/frozen-bakery-products-market/
hydroponics market size,/research-report/hydroponics-market/
endoscopy devices market size,/research-report/endoscopy-devices-market/
cosmetic surgery market size,/research-report/cosmetic-surgery-equipments-market/
water treatment equipment market size,/research-report/water-treatment-equipment-market/
polyurethane market size,/research-report/polyurethane-markett/
osteoporosis market size,/research-report/global-osteoporosis-market/
local anesthsia drugs market size,/research-report/global-local-anesthsia-drugs-market/
mobile health market size,/research-report/mobile-health-mhealth-market/
multiparameter patient monitoring devices market size,/research-report/the-global-multiparameter-patient-monitoring-devices-market/
advanced driver assistance systems market size,/research-report/global-advanced-driver-assistance-system-market/
oilfield services market size,/research-report/global-oilfield-services-market/
contrast agents market size,/research-report/global-contrast-agents-market/
food probiotics market size,/research-report/global-food-probiotics-market/
high density polyethylene market size,/research-report/hdpe-high-density-polyethylene-market/
incontinence devices market size,/research-report/global-incontinence-devices-market/
genome editing market size,/research-report/genome-editing-market/
snack food market size,/research-report/snack-food-market/
clinical trial management system market size,/research-report/clinical-trial-management-system-market/
adhesives and sealants market size,/research-report/adhesives-sealants-market/
paints and coatings market size,/research-report/paints-and-coatings-market/
food enzymes market size,/research-report/food-enzymes-market/
medical image analysis software market size,/research-report/medical-image-analysis-software-market/
biopharmaceuticals market size,/research-report/global-biopharmaceuticals-market/
population health management market size,/research-report/population-health-management-market/
mobile c-arms market size,/research-report/global-mobile-c-arms-market/
mri systems market size,/research-report/global-mri-systems-market/
collagen market size,/research-report/collagen-market/
bio lubricants market size,/research-report/bio-lubricants-market/
construction chemicals market size,/research-report/global-construction-chemicals-market/
trans catheter aortic valve replacement market size,/research-report/global-trans-catheter-aortic-valve-replacement-market/
water treatment chemicals market size,/research-report/global-water-treatment-chemicals-market/
polyvinyl chloride market size,/research-report/polyvinyl-chloride-pvc-market/
power system simulation market size,/research-report/global-power-system-simulation-market/
naphthalene market size,/research-report/naphthalene-market/
type 2 diabeties market size,/research-report/global-type-2-diabetes-size/
patient monitoring equipments market size,/research-report/patient-monitoring-equipments-market/
blood pressure moniters market size,/research-report/global-blood-pressure-monitors-market/
nucleic acid isolation and purification market size,/research-report/global-nucleic-acid-isolation-and-purification-market/
industrial water treatment market size,/research-report/global-industrial-water-treatment-market/
remote patient monitoring market size,/research-report/remote-patient-monitoring-market/
silage additives market size,/licenses/site-user/page/7/
flat glass market size,/research-report/flat-glass-market/
precision medicine market size,/research-report/global-precision-medicine-market/
ecg market size,/research-report/ecg-market/
medical imaging market size,/research-report/medical-imaging-market/
diabetes devices market size,/research-report/global-diabetes-devices-market/
ultrasound devices market size,/research-report/ultrasound-devices-market/
fungicides market size,/research-report/fungicides-market/
agrochemicals market size,/agrochemicals-category/
trans catheter aortic valve replacement size market size,/research-report/global-trans-catheter-aortic-valve-replacement-market/
power generation market size,/research-report/global-commercial-distributed-energy-generation-market/
precision agriculture market size,/research-report/precision-agriculture-market/
bio pesticides market size,/research-report/bio-pesticides-market/
anti-aging market size,/research-report/global-anti-aging-market/
micronutrient fertilizers market size,/licenses/enterprise/page/7/
managed services market size,
modular data center market size,
smart glass market size,/research-report/smart-glass-market/
digital signage market size,
contact lenses market size,
molecular diagnostics market size,/research-report/molecular-diagnostics-market/
stevia market size,/food-and-beverages-category/
yogurt market size,
bottled water market size,/research-report/bottled-water-market/
baby food market size,
beta glucan market size,
energy drinks market size,
diesel generator market size,/research-report/global-diesel-generator-market/
tackifier market size,
microspheres market size,
lithium market size,/research-report/lithium-market/
seeds market size,
telemedicine market size,
genetic testing market size,
healthcare analytics market size,/research-report/healthcare-analytics-market/
whey protein market size,
lubricants market size,
wearable medical devices market size,/research-report/wearable-medical-devices-market/
next generation sequencing market size,
nutraceuticals market size,/research-report/nutraceuticals-market/
plastic market size,
renewable energy market size,/research-report/renewable-energy-market/
healthcare it market size,
respiratory devices market size,/research-report/respiratory-devices-market/
bio fertilizers market size,/research-report/bio-fertilizers-market/
adjuvants market size,/research-report/adjuvants-market/
alcoholic beverages market size,/research-report/alcoholic-beverages-market/
bone densitometers market size,/research-report/bone-densitometer-market/
chip inductor market size,
coconut based foods market size,/research-report/global-coconut-foods-market/
computed tomography market size,/research-report/global-computed-tomography-market/
heavy construction machinery market size,
indonesia freight and logistics market size,
intra ocular lens market size,
oil & gas equipment rental market size,
oral care market size,/research-report/oral-care-market/
orthopaedic devices market size,
radiology information system market size,/research-report/radiology-information-system-market/
steel market size,
veterinary diagonistics market size,/research-report/veterinary-diagnostics-market/
fluoropolymers market size,
hardware power simulation market size,
pharmaceutical mass flow converter market size,
operating room equipment market size,/research-report/global-operating-room-equipment-market/
renal dialysis market size,/research-report/renal-dialysis-equipment-market/
clinical it systems market size,
sugar reduction market size,/research-report/sugar-reduction-market/
post menopausal osteoporois market size,
transdermal drug delivery devices market size,
diabetic retinotherapy market size,
patient examination devices market size,/research-report/global-patient-examination-devices-market/
insulin resistance market size,/research-report/global-insulin-resistance-market-size/
sjôøωgrenôøωs syndrome market size,
in-vitro diagnostics market size,
lithium-ion battery market size,/research-report/lithium-ion-battery-separator-market/
micro-elecromechanical sensors market size,/research-report/global-micro-elecromechanical-sensors-market/
